{
	"realName": {
		"givenName": "Ivan",
		"familyName": "Vasilev",
		"placeFamilyNameFirst": false,
		"hideFamilyNameOnWebsite": false
	},
	"githubAccountName": "konclave",
	"company": "Satellytes",
	"when": {
		"friday": true,
		"saturday": true
	},
	"iCanTakeNotesDuringSessions": false,
	"tags": ["Typescript", "React", "Zustand", "Microfrontends"],
	"vegan": false,
	"vegetarian": false,
	"allergies": [],
	"whatIsMyConnectionToJavascript": "It's the my main programming language for more than 10 years.",
	"whatCanIContribute": "Creating React applications, basics of accessibility",	
  "tShirtSize": "L",
	"linkedin": "https://www.linkedin.com/in/konclave/"
}
