{
	"realName": {
		"givenName": "Mohammed",
		"familyName": "Faour",
		"placeFamilyNameFirst": false,
		"hideFamilyNameOnWebsite": false
	},
	"githubAccountName": "mfaour34",
	"company": "FINN GmbH",
	"when": {
		"friday": true,
		"saturday": false
	},
	"iCanTakeNotesDuringSessions": false,
	"tags": ["Node", "Typescript", "Serverless"],
	"vegan": false,
	"vegetarian": true,
	"allergies": [],
	"whatIsMyConnectionToJavascript": "daily business (work and private projects)",
	"whatCanIContribute": "Sharing some knowledge about stuff i've done",
	"tShirtSize": "L",
	"linkedin": "https://www.linkedin.com/in/mohammed-faour-6167451b0/"
}
