{
	"realName": {
		"givenName": "Stefanie",
		"familyName": "Hasler",
		"placeFamilyNameFirst": false,
		"hideFamilyNameOnWebsite": false
	},
	"githubAccountName": "haslers",
	"company": "codecentric AG",
	"when": {
		"friday": true,
		"saturday": true
	},
	"iCanTakeNotesDuringSessions": false,
	"tags": ["Typescript", "React", "Next.js", "Communication", "Performance"],
	"vegan": true,
	"vegetarian": false,
	"whatIsMyConnectionToJavascript": "I use Typescript every day, and Javascript whenever I am confronted with a library which does not have types.",
	"whatCanIContribute": "Facilitation ;), 10 years of development experience, contact, a buddy for everyone who needs one",
	"tShirtSize": "M",
	"linkedin": "https://www.linkedin.com/in/stefanie-hasler-05458a4/"
}
