{
  "realName": {
    "givenName": "Fabian",
    "familyName": "Dietenberger",
    "placeFamilyNameFirst": false,
    "hideFamilyNameOnWebsite": false
  },
  "githubAccountName": "feedm3",
  "company": "Satellytes",
  "when": {
    "friday": true,
    "saturday": true
  },
  "iCanTakeNotesDuringSessions": false,
  "tags": ["React", "Module Federation", "Rspack", "Microfrontends", "Typescript"],
  "vegan": false,
  "vegetarian": false,
  "allergies": [],
  "whatIsMyConnectionToJavascript": "Working full stack with JS for over 10 years. Frontend, backend, infra, whatever it takes to make a great product!",
  "whatCanIContribute": "Currently working with React and Module Federation to build micro frontends at enterprise level, so happy to share experience and knowledge.",
  "tShirtSize": "M",
  "linkedin": "https://www.linkedin.com/in/fabiandietenberger/",
  "website": "https://www.satellytes.com"
}
