{
	"realName": {
		"givenName": "Mohsin",
		"familyName": "Ul Haq",
		"placeFamilyNameFirst": false,
		"hideFamilyNameOnWebsite": false
	},
	"githubAccountName": "mohsinulhaq",
	"company": "HolidayCheck",
	"when": {
		"friday": true,
		"saturday": true
	},
	"iCanTakeNotesDuringSessions": false,
	"tags": ["TypeScript", "React", "React Native", "RTK Query"],
	"vegan": false,
	"vegetarian": false,
	"whatIsMyConnectionToJavascript": "Working on TS, React and React Native",
	"whatCanIContribute": "Can share information about working on design systems, RTK Query, etc.",
	"tShirtSize": "M",
	"linkedin": "http://linkedin.com/in/mohsinulhaq",
	"X": "mohsinulhaq"
}
