{
	"realName": {
		"givenName": "Tamara",
		"familyName": "Bogantseva"
	},
	"githubAccountName": "TamaraBogantseva",
	"company": "compose.us",
	"when": {
		"friday": true,
		"saturday": true
	},
	"iCanTakeNotesDuringSessions": true,
	"tags": ["Flottform.io", "Svelte", "TypeScript", "UI/UX"],
	"vegan": false,
	"vegetarian": false,
	"whatIsMyConnectionToJavascript": "Working with JavaScript",
	"whatCanIContribute": "Ready to talk about flottform.io",
	"tShirtSize": "M",
	"linkedin": "https://www.linkedin.com/in/tamara-bogantseva/",
	"X": "tamarabogant"
}
