{
	"realName": {
		"givenName": "Christoph",
		"familyName": "Menzel",
		"placeFamilyNameFirst": false,
		"hideFamilyNameOnWebsite": false
	},
	"githubAccountName": "traveling-developer",
	"company": "inovex",
	"when": {
		"friday": true,
		"saturday": true
	},
	"iCanTakeNotesDuringSessions": false,
	"tags": ["Security", "CleanCode", "Dart"],
	"vegan": false,
	"vegetarian": false,
	"allergies": [],
	"whatIsMyConnectionToJavascript": "In the software development business for years.",
	"whatCanIContribute": "Sessions about Dart & OWASP Dependency Track",
	"tShirtSize": "S",
	"mastodon": "https://mastodon.social/@traveling_developer",
	"linkedin": "https://www.linkedin.com/in/christoph-menzel/",
	"X": "menzel42"
}
