{
	"realName": {
		"givenName": "Marvin",
		"familyName": "Hagemeister",
		"placeFamilyNameFirst": false,
		"hideFamilyNameOnWebsite": false
	},
	"githubAccountName": "marvinhagemeister",
	"company": "Deno",
	"when": {
		"friday": true,
		"saturday": true
	},
	"iCanTakeNotesDuringSessions": false,
	"tags": ["Deno", "Fresh", "TypeScript", "Rust", "Web APIs", "Preact"],
	"vegan": false,
	"vegetarian": false,
	"whatIsMyConnectionToJavascript": "Working at Deno and on Preact",
	"whatCanIContribute": "Can share stories about working on Preact, code golfing, optimizing JS tools, Signals, etc",
	"tShirtSize": "M",
	"mastodon": "https://infosec.exchange/@marvinh",
	"linkedin": "https://de.linkedin.com/in/marvin-hagemeister-53758b204",
	"X": "marvinhagemeist",
	"website": "https://marvinh.dev/"
}
