{
  "realName": {
    "givenName": "Kai",
    "familyName": "Kopecky",
    "placeFamilyNameFirst": false,
    "hideFamilyNameOnWebsite": true
  },
  "githubAccountName": "kkopecky",
  "company": "Saab Deutschland GmbH",
  "when": {
    "friday": true,
    "saturday": true
  },
  "iCanTakeNotesDuringSessions": false,
  "tags": ["React", "TypeScript", "Redux"],
  "vegan": false,
  "vegetarian": false,
  "allergies": [],
  "whatIsMyConnectionToJavascript": "Someone has to fix the internet",
  "whatCanIContribute": "I'm happy to share my experience",
  "tShirtSize": "3XL",
  "linkedin": "https://www.linkedin.com/in/kai-kopecky-9365b122/"
}
