{
	"realName": {
		"givenName": "Michael",
		"familyName": "Leimst√§dtner",
		"placeFamilyNameFirst": false,
		"hideFamilyNameOnWebsite": false
	},
	"githubAccountName": "makmic",
	"company": "makandra",
	"when": {
		"friday": false,
		"saturday": true
	},
	"iCanTakeNotesDuringSessions": false,
	"tags": ["Rails", "Unpoly", "Web Audio API", "A11Y"],
	"whatIsMyConnectionToJavascript": "I've been writing some JS every other day for the past decade",
	"whatCanIContribute": "I might be able to answer some Unpoly question and give perspective on rather plain JS settings with server side rendering apps",
	"tShirtSize": "M",
	"linkedin": "https://www.linkedin.com/in/leimstaedtner/"
}
