{
	"realName": {
		"givenName": "Lukas",
		"familyName": "Taegert-Atkinson",
		"placeFamilyNameFirst": false,
		"hideFamilyNameOnWebsite": false
	},
	"githubAccountName": "lukastaegert",
	"company": "TNG Technology Consulting",
	"when": {
		"friday": true,
		"saturday": false
	},
	"iCanTakeNotesDuringSessions": false,
	"tags": ["GraphQL", "Rust", "Workers", "Bundling"],
	"vegan": false,
	"vegetarian": true,
	"allergies": [],
	"whatIsMyConnectionToJavascript": "I love hacking things as well as deeply understanding them, which made me maintainer of RollupJS since 2017. Since then, there are few things in the language I did not touch yet.",
	"whatCanIContribute": "Experiences from integrating native Rust code in JavaScript, possibly something about schema stitching in GraphQL.",
	"tShirtSize": "M",
	"mastodon": "https://m.webtoo.ls/@lukastaegert",
	"website": "https://rollupjs.org"
}
