{
  "realName": {
    "givenName": "Gustaf",
    "familyName": "Graf",
    "placeFamilyNameFirst": false,
    "hideFamilyNameOnWebsite": false
  },
  "githubAccountName": "gggscript",
  "company": "onyo",
  "when": {
    "friday": true,
    "saturday": false
  },
  "iCanTakeNotesDuringSessions": false,
  "tags": [
    "Thinking better on purpose",
    "Reducing existential risk",
    "Rabbit holing"
  ],
  "vegan": true,
  "vegetarian": true,
  "allergies": [],
  "whatIsMyConnectionToJavascript": "7 years of programming, the last 2 of which were at my job",
  "whatCanIContribute": "You tell me about your niche interest ü§ù I try to understand as deeply as possible & ask something useful",
  "tShirtSize": "S"
}
